,movie,rating,quote,polarity,subjectivity
80,The Matrix,8.7,"[""Morpheus: We've done it, Trinity. We've found him."", ""Trinity: I hope you're right."", ""Morpheus: You don't have to hope. I *know* it.""]",0.2857142857142857,0.5357142857142857
81,The Matrix,8.7,"['Neo: Am I dead?', 'Morpheus: Far from it.']",-0.05,0.7
82,The Matrix,8.7,"[""Cypher: I'm tired, Trinity. Tired of this war, tired of fighting... I'm tired of the ship, being cold, eating the same goddamn goop everyday...""]",-0.3428571428571429,0.6464285714285714
84,The Matrix,8.7,"['Agent Brown: She got out.', ""Agent Smith: Doesn't matter."", 'Agent Brown: The informant is real.', 'Agent Smith: Yes.', 'Agent Jones: We have the name of their next target.', 'Agent Brown: The name is Neo.', ""Agent Smith: We'll need a search running."", 'Agent Jones: It has already begun.']",0.1,0.15000000000000002
86,The Matrix,8.7,['Agent Brown: Perhaps we are asking the wrong questions.'],-0.5,0.9
87,The Matrix,8.7,"[""[Neo tries a drink made by Dozer and winces]  Cypher: Good shit, huh? It's good for two things: degreasing engines and killing brain cells.""]",0.27499999999999997,0.6000000000000001
88,The Matrix,8.7,"['[Agent Smith has shot Neo with several bullets]  Agent Smith: Check him.', ""[Agent Brown feels Neo's pulse]  Agent Brown: He's gone."", 'Agent Smith: Good bye, Mr Anderson.']",0.35,0.30000000000000004
90,The Matrix,8.7,"[""[Cypher has betrayed the crew and is pulling their plugs one by one]  Cypher: By the way, if you have something terribly important to say to Switch, I'd suggest you say it now."", ""Trinity: Oh no, please don't..."", 'Switch: Not like this. Not like this.', '[Cypher pulls her plug, and her in-Matrix body falls dead]  Cypher: Too late.', 'Trinity: God damn you Cypher!', ""Cypher: Don't hate me Trinity... I'm just the messenger.""]",-0.24375000000000002,0.725
91,The Matrix,8.7,"['[Neo runs down the alleyway and gets trapped]  Neo: Help!, need a little help!', 'Tank: The door.']",-0.21331018518518519,0.262962962962963
93,The Matrix,8.7,"[""[talking to the unconscious Morpheus]  Cypher: If you'd told us the truth, we would've told you to shove that red pill right up your ass.""]",0.14285714285714285,0.26785714285714285
94,The Matrix,8.7,['Switch: The digital pimp hard at work.'],-0.14583333333333334,0.2708333333333333
95,The Matrix,8.7,"[""Cypher: [Is about to try to unplug Neo] If Morpheus was right, then there's no way I can pull this plug. I mean if Neo is the One, then there would have to be some kind of miracle to stop me. Right? I mean how can he be the One if he's dead?""]",-0.05765306122448981,0.678061224489796
96,The Matrix,8.7,"[""Cypher: No. I don't believe it."", ""Tank: Believe it or not, you piece of shit, you're still gonna burn.""]",-0.2,0.8
97,The Matrix,8.7,"[""Agent Smith: I'm going to enjoy watching you die, Mr. Anderson.""]",0.4,0.5
98,The Matrix,8.7,['Agent Smith: Find them and destroy them'],-0.2,0.0
102,The Matrix,8.7,"[""Neo: I can't go back, can I?"", 'Morpheus: No. But if you could, would you really want to?']",0.1,0.1
103,The Matrix,8.7,"['[after landing the Nebuchaunezzer to hide from the Sentinels]  Morpheus: How we doing Tank?', '[Tank types on the keyboard and the main power goes off]  Tank: Main power offline. EMP armed...', '[Tank opens the cover to the EMP switch]  Tank: and ready.', 'Neo: EMP?', 'Trinity: Electro-Magnetic Pulse, disables any electrical system within the blast radius, only weapon we have against the machines.', 'Morpheus: Quiet.']",0.10666666666666666,0.5
104,The Matrix,8.7,"[""Cypher: The image translators work for the construct program - but there's way too much information to decode the Matrix.""]",0.2,0.2
106,The Matrix,8.7,"[""[after the truth of the Matrix has been revealed to Neo, he lies in his bunk with Morpheus in the room with him]  Neo: I can't go back, can I?"", ""Morpheus: No. But if you could, would you really want to? I feel I owe you an apology. We have a rule: we never free a mind once it's reached a certain age. It's dangerous, the mind has trouble letting go. I've seen it before and I'm sorry. I did what I did because... I had to. When the Matrix was first built, there was a man born inside who had the ability to change whatever he wanted, to remake the Matrix as he saw fit. It was he who freed the first of us, taught us the truth. As long as the Matrix exists the human race will never be free. After he died, the Oracle prophesized his return and that his coming would hail the destruction of the Matrix, end the war, bring freedom to our people. That is why there are those of us who have spent our entire lives searching the Matrix looking for him. I did what I did because I believe that search is over."", ""[beat]  Morpheus: Get some rest. You're going to need it."", 'Neo: For what?', 'Morpheus: Your training.']",0.004285714285714295,0.4508730158730158
107,The Matrix,8.7,"['Tank: What does it mean?', ""Switch: It doesn't mean anything.""]",-0.3125,0.6875
109,The Matrix,8.7,"[""Agent Smith: Never send a human to do a machine's job."", ""Agent Brown: If, indeed, the insider has failed, they'll sever the connection as soon as possible. Unless..."", ""Agent Jones: ...they're dead. In either case..."", 'Agent Smith: ...we have no choice but to continue as planned. Deploy the sentinels. Immediately.']",-0.175,0.44999999999999996
110,The Matrix,8.7,"[""Mouse: [to Neo] So I understand that, uh, you've run through the Agent Training program. You know, I, um... I wrote that program."", 'Apoc: Here it comes...', 'Mouse: So, what did you think of her?', 'Neo: Of who?', ""Mouse: The woman in the red dress. I designed her. She, um... Well, she doesn't talk very much, but-but if you'd like to meet her, I can arrange for a much more personalized milieu."", 'Switch: The digital pimp hard at work.', 'Mouse: [annoyed at Switch] Pay no attention to these hypocrites, Neo. To deny our own impulses is to deny the very thing that makes us human.']",-0.05742424242424242,0.5001515151515151
112,The Matrix,8.7,"[""[Neo has just been revived after escaping from the machines]  Neo: Morpheus, what's happened to me? What is this place?"", ""Morpheus: More important than 'Where?' is 'When?'"", 'Neo: When?', ""Morpheus: You believe it's the year 1999 when in fact it's closer to 2199. I can't tell you exactly what year it is because we honestly don't know. There's nothing I can say that will explain it for you, Neo.""]",0.4375,0.6625
113,The Matrix,8.7,"[""Morpheus: [explaining 'agents'] Sentient programs. They can move in and out of any software still hardwired to their system.""]",-0.75,1.0
114,The Matrix,8.7,"[""Morpheus: Remember, all I'm offering is the truth. Nothing more.""]",0.5,0.5
